{
  "$schema": "../../docs/project/schema/v1-m06-reward-trajectory-contract.schema.json",
  "schema_version": "openttd-rl-v1-m06-reward-trajectory-contract-1",
  "semantic_version": "1.0.0",
  "status": "FROZEN_FOUNDATION",
  "contract_id": "m06-reward-episode-trajectory-v1",
  "identity": {
    "compatibility_algorithm": "sha256-canonical-json-v1",
    "compatibility_sha256": "9d8f9c2fc6074d899fa3b0047c55e3fb15cc5c17cddeaceaa1fd5389e53c8c9e",
    "schema_path": "docs/project/schema/v1-m06-reward-trajectory-contract.schema.json",
    "schema_sha256": "fa6a776fb45649589058f1ea726a6f82b5c3afbb4144edac337383fe6152c2ad"
  },
  "engine": {
    "openttd_version": "15.3",
    "source_commit": "14ec60f248547d4d062a1160f0fc26d742319888",
    "m03_bridge_compatibility_sha256": "4701a21ae106f6fa120db1b89c3929d16c29afafb8e0198126173137ed2af2d6",
    "m04_observation_compatibility_sha256": "7f8a46af1fe2a2c23e755c71b3bc2d04c9a0d057c573e901e5c9ed9178ca13eb",
    "m05_action_compatibility_sha256": "215c7d3ebeea97f1629debee4a2d10301838ccfd3085e4828685591677b58536",
    "m05_composed_source_identity_sha256": "9bb57367151fbf4eedcd802d179c946685a911bec9b99d7573501e0f52a3b2bd"
  },
  "boundary": {
    "pre_state": "S_t-at-issued-M05-mask-boundary",
    "action": "M05-action-validated-and-executed-once",
    "advance": "exactly-128-complete-StateGameLoop-calls",
    "post_state": "S_t-plus-1-at-next-safe-boundary",
    "reward_timing": "integer-raw-deltas-from-S_t-to-S_t-plus-1-after-action-and-ticks",
    "termination_timing": "after-reward-at-S_t-plus-1-before-transition-commit",
    "quarter_rotation_policy": "sum-current-and-all-valid-old-economy-entries-before-differencing",
    "quarter_history_safety": "65536-tick-episode-is-shorter-than-24-quarter-history-retention",
    "invalid_attempt_policy": "ILLEGAL_INPUT-is-a-fail-closed-non-transition-correctness-defect-and-never-shaped-reward"
  },
  "candidate_dispositions": [
    {
      "candidate_id": "POS-001",
      "requirement": "REW-001",
      "name": "operating_profit",
      "disposition": "INCLUDED",
      "component_id": "RC-002",
      "source": "delta-of-lifetime-company-income-plus-expenses",
      "information_boundary": "causal-engine-state-at-S_t-and-S_t-plus-1",
      "rationale": "Direct realized economics penalize routes whose running and property costs exceed revenue."
    },
    {
      "candidate_id": "POS-002",
      "requirement": "REW-001",
      "name": "passenger_delivery",
      "disposition": "INCLUDED",
      "component_id": "RC-001",
      "source": "delta-of-lifetime-delivered-passenger-count",
      "information_boundary": "causal-engine-state-at-S_t-and-S_t-plus-1",
      "rationale": "Delivery is the required useful-gameplay event and is attributed only to the interval that records it."
    },
    {
      "candidate_id": "POS-003",
      "requirement": "REW-001",
      "name": "transported_passenger_growth",
      "disposition": "DIAGNOSTIC_ONLY",
      "component_id": null,
      "source": "town-percent-transported",
      "information_boundary": "causal-but-quarterly-and-lagged",
      "rationale": "It is a delayed proxy for the already rewarded delivery and can double-pay one event."
    },
    {
      "candidate_id": "POS-004",
      "requirement": "REW-001",
      "name": "station_rating_improvement",
      "disposition": "REJECTED",
      "component_id": null,
      "source": "station-or-town-rating",
      "information_boundary": "causal-but-proxy",
      "rationale": "Rating can improve without profitable delivery and creates a proxy-farming objective."
    },
    {
      "candidate_id": "POS-005",
      "requirement": "REW-001",
      "name": "route_profitability",
      "disposition": "DIAGNOSTIC_ONLY",
      "component_id": null,
      "source": "vehicle-period-profit",
      "information_boundary": "causal-but-period-resetting",
      "rationale": "Vehicle profit is retained for analysis but duplicates company operating profit in the single-route V1 scope."
    },
    {
      "candidate_id": "POS-006",
      "requirement": "REW-001",
      "name": "utilization",
      "disposition": "DIAGNOSTIC_ONLY",
      "component_id": null,
      "source": "running-and-cargo-state",
      "information_boundary": "causal-engine-state",
      "rationale": "Movement or loading is not useful by itself; the negative idle component is sufficient for the sparse baseline."
    },
    {
      "candidate_id": "POS-007",
      "requirement": "REW-001",
      "name": "productive_expansion",
      "disposition": "REJECTED",
      "component_id": null,
      "source": "infrastructure-and-vehicle-count-growth",
      "information_boundary": "causal-but-speculative",
      "rationale": "Construction is not productive until it causes delivery and profit, so rewarding it invites waste."
    },
    {
      "candidate_id": "POS-008",
      "requirement": "REW-001",
      "name": "long_term_company_value",
      "disposition": "DIAGNOSTIC_ONLY",
      "component_id": null,
      "source": "CalculateCompanyValue",
      "information_boundary": "causal-engine-state",
      "rationale": "Company value mixes purchased assets and operating results and would double-pay capital acquisition."
    },
    {
      "candidate_id": "NEG-001",
      "requirement": "REW-002",
      "name": "bankruptcy",
      "disposition": "INCLUDED",
      "component_id": "RC-008",
      "source": "learning-company-absence-or-native-bankruptcy-state",
      "information_boundary": "causal-post-boundary-terminal-state",
      "rationale": "Bankruptcy is a game terminal outcome and receives a finite terminal penalty."
    },
    {
      "candidate_id": "NEG-002",
      "requirement": "REW-002",
      "name": "invalid_action",
      "disposition": "DIAGNOSTIC_ONLY",
      "component_id": null,
      "source": "M05-ILLEGAL_INPUT-attempt-log",
      "information_boundary": "controller-correctness-state",
      "rationale": "A masked or malformed action is a correctness defect, not an accepted environment transition; stopping it is stronger than reward shaping."
    },
    {
      "candidate_id": "NEG-003",
      "requirement": "REW-002",
      "name": "repeated_construction_failure",
      "disposition": "INCLUDED",
      "component_id": "RC-005",
      "source": "M05-NATIVE_REJECTED-outcome",
      "information_boundary": "causal-action-result",
      "rationale": "Unexpected native rejection consumes a decision interval and is explicitly discouraged."
    },
    {
      "candidate_id": "NEG-004",
      "requirement": "REW-002",
      "name": "idle_vehicle",
      "disposition": "INCLUDED",
      "component_id": "RC-006",
      "source": "post-boundary-stopped-primary-bus-count-times-advanced-ticks",
      "information_boundary": "causal-engine-state",
      "rationale": "Purchased buses left stopped consume opportunity without producing delivery."
    },
    {
      "candidate_id": "NEG-005",
      "requirement": "REW-002",
      "name": "unused_station",
      "disposition": "DIAGNOSTIC_ONLY",
      "component_id": null,
      "source": "station-route-and-cargo-state",
      "information_boundary": "causal-engine-state",
      "rationale": "The M05 fixed two-stop route makes this largely redundant with capital spend and idle-vehicle penalties."
    },
    {
      "candidate_id": "NEG-006",
      "requirement": "REW-002",
      "name": "excessive_infrastructure_spend",
      "disposition": "INCLUDED",
      "component_id": "RC-003",
      "source": "sum-of-positive-M05-native-command-costs",
      "information_boundary": "causal-action-result",
      "rationale": "Capital spend is excluded from operating profit and therefore receives one separately logged bounded cost."
    },
    {
      "candidate_id": "NEG-007",
      "requirement": "REW-002",
      "name": "valueless_route_duplication",
      "disposition": "REJECTED",
      "component_id": null,
      "source": "M05-route-identity",
      "information_boundary": "causal-action-state",
      "rationale": "An identical route is masked and the V1 catalog has no separate route object to duplicate."
    },
    {
      "candidate_id": "NEG-008",
      "requirement": "REW-002",
      "name": "vehicle_loss",
      "disposition": "INCLUDED",
      "component_id": "RC-007",
      "source": "positive-decrease-in-owned-primary-bus-count",
      "information_boundary": "causal-engine-state",
      "rationale": "Loss of an owned bus destroys useful capacity and is distinct from ordinary operating cost."
    },
    {
      "candidate_id": "NEG-009",
      "requirement": "REW-002",
      "name": "destructive_loop",
      "disposition": "REJECTED",
      "component_id": null,
      "source": "M05-action-catalog",
      "information_boundary": "not-agent-reachable-in-V1",
      "rationale": "Selling and infrastructure removal are excluded from M05, so a build/remove or buy/sell loop is unreachable."
    },
    {
      "candidate_id": "NEG-010",
      "requirement": "REW-002",
      "name": "excessive_noop",
      "disposition": "INCLUDED",
      "component_id": "RC-004",
      "source": "M05-NO_OP-outcome",
      "information_boundary": "causal-action-result",
      "rationale": "A small per-decision penalty prevents unlimited waiting from being free while leaving time for service delivery."
    }
  ],
  "reward": {
    "raw_integer_policy": "all-source-deltas-are-checked-integers-and-bool-is-never-an-integer",
    "component_dtype": "float64",
    "aggregation": "IEEE-754-binary64-left-fold-in-component-order-starting-from-positive-zero",
    "nonfinite_policy": "fatal-NONFINITE-failure-no-training-transition",
    "components": [
      {
        "component_id": "RC-001",
        "order": 0,
        "name": "passenger_delivery",
        "raw_field": "delivered_passengers_delta",
        "raw_unit": "passengers",
        "raw_min": 0,
        "raw_max": 128,
        "coefficient_numerator": 1,
        "coefficient_denominator": 16,